{
  "created": "2026-10-17T20:00:00Z",
  "project": "acme",
  "current_version": "0.1.0",
  "versions": {
    "0.1.0": {
      "created": "2026-10-17T20:00:00Z",
      "needs_amount": 2,
      "needs": {
        "REQ-A-1": {
          "id": "REQ-A-1",
          "type": "requirement",
          "title": "One thing",
          "status": "accepted",
          "links": ["PS-1"],
          "source": {
            "file": "SPEC.md",
            "line": 1
          },
          "derives-from": ["PS-1"]
        }
      }
    }
  }
}
